{
  "$schema": "./question-bank.schema.json",
  "version": 1,
  "sourceFile": ".ai/veriffica-questions-list/list-of-questions.md",
  "allowedAnswers": [
    "yes",
    "no",
    "dont_know"
  ],
  "questions": [
    {
      "id": "q_p2_base_car_body_corrosion_bonnet",
      "groupId": "g_p2_base_car_body_corrosion",
      "part": "part2",
      "section": "Car Body",
      "subsection": "Corrosion, blistering",
      "label": "Bonnet",
      "order": 10
    },
    {
      "id": "q_p2_base_car_body_corrosion_boot_lid",
      "groupId": "g_p2_base_car_body_corrosion",
      "part": "part2",
      "section": "Car Body",
      "subsection": "Corrosion, blistering",
      "label": "Boot lid",
      "order": 20
    },
    {
      "id": "q_p2_base_car_body_corrosion_fender",
      "groupId": "g_p2_base_car_body_corrosion",
      "part": "part2",
      "section": "Car Body",
      "subsection": "Corrosion, blistering",
      "label": "Fender",
      "order": 30
    },
    {
      "id": "q_p2_base_car_body_corrosion_gasket_window_areas",
      "groupId": "g_p2_base_car_body_corrosion",
      "part": "part2",
      "section": "Car Body",
      "subsection": "Corrosion, blistering",
      "label": "Gasket and window areas",
      "order": 40
    },
    {
      "id": "q_p2_base_car_body_corrosion_body_dents",
      "groupId": "g_p2_base_car_body_corrosion",
      "part": "part2",
      "section": "Car Body",
      "subsection": "Corrosion, blistering",
      "label": "Body dents",
      "order": 50
    },
    {
      "id": "q_p2_base_car_body_corrosion_fuel_filler_area",
      "groupId": "g_p2_base_car_body_corrosion",
      "part": "part2",
      "section": "Car Body",
      "subsection": "Corrosion, blistering",
      "label": "Fuel filler area",
      "order": 60
    },
    {
      "id": "q_p2_base_car_body_corrosion_hinges_connections",
      "groupId": "g_p2_base_car_body_corrosion",
      "part": "part2",
      "section": "Car Body",
      "subsection": "Corrosion, blistering",
      "label": "Hinges connections",
      "order": 70
    },
    {
      "id": "q_p2_base_car_body_corrosion_door_edges",
      "groupId": "g_p2_base_car_body_corrosion",
      "part": "part2",
      "section": "Car Body",
      "subsection": "Corrosion, blistering",
      "label": "Door edges",
      "order": 80
    },
    {
      "id": "q_p2_base_car_body_corrosion_handles",
      "groupId": "g_p2_base_car_body_corrosion",
      "part": "part2",
      "section": "Car Body",
      "subsection": "Corrosion, blistering",
      "label": "Handles",
      "order": 90
    },
    {
      "id": "q_p2_base_car_body_corrosion_engine_compartment",
      "groupId": "g_p2_base_car_body_corrosion",
      "part": "part2",
      "section": "Car Body",
      "subsection": "Corrosion, blistering",
      "label": "Engine compartment",
      "order": 100
    },
    {
      "id": "q_p2_base_car_body_corrosion_floor_moisture",
      "groupId": "g_p2_base_car_body_corrosion",
      "part": "part2",
      "section": "Car Body",
      "subsection": "Corrosion, blistering",
      "label": "Floor (moisture)",
      "order": 110
    },
    {
      "id": "q_p2_base_car_body_corrosion_windshield",
      "groupId": "g_p2_base_car_body_corrosion",
      "part": "part2",
      "section": "Car Body",
      "subsection": "Corrosion, blistering",
      "label": "Windshield",
      "order": 120
    },
    {
      "id": "q_p2_base_car_body_corrosion_floor_under_back_seats",
      "groupId": "g_p2_base_car_body_corrosion",
      "part": "part2",
      "section": "Car Body",
      "subsection": "Corrosion, blistering",
      "label": "Floor, under back seats",
      "order": 130
    },
    {
      "id": "q_p2_base_car_body_repair_traces_paint_discoloration",
      "groupId": "g_p2_base_car_body_repair_traces",
      "part": "part2",
      "section": "Car Body",
      "subsection": "traces of repairs / use",
      "label": "Paint discoloration",
      "order": 140
    },
    {
      "id": "q_p2_base_car_body_repair_traces_paint_cracking",
      "groupId": "g_p2_base_car_body_repair_traces",
      "part": "part2",
      "section": "Car Body",
      "subsection": "traces of repairs / use",
      "label": "Paint cracking",
      "order": 150
    },
    {
      "id": "q_p2_base_car_body_repair_traces_paint_swelling",
      "groupId": "g_p2_base_car_body_repair_traces",
      "part": "part2",
      "section": "Car Body",
      "subsection": "traces of repairs / use",
      "label": "Paint swelling",
      "order": 160
    },
    {
      "id": "q_p2_base_car_body_repair_traces_visible_lumps_and_dirt_under_paint",
      "groupId": "g_p2_base_car_body_repair_traces",
      "part": "part2",
      "section": "Car Body",
      "subsection": "traces of repairs / use",
      "label": "Visible lumps and dirt under the paint",
      "order": 170
    },
    {
      "id": "q_p2_base_car_body_repair_traces_paint_polishing_paste_on_seals",
      "groupId": "g_p2_base_car_body_repair_traces",
      "part": "part2",
      "section": "Car Body",
      "subsection": "traces of repairs / use",
      "label": "Traces of paint/polishing paste on the seals",
      "order": 180
    },
    {
      "id": "q_p2_base_car_body_repair_traces_badly_matched_body_parts",
      "groupId": "g_p2_base_car_body_repair_traces",
      "part": "part2",
      "section": "Car Body",
      "subsection": "traces of repairs / use",
      "label": "Badly matched body parts",
      "order": 190
    },
    {
      "id": "q_p2_base_car_body_repair_traces_moldings_curves_or_uneven_body_lines",
      "groupId": "g_p2_base_car_body_repair_traces",
      "part": "part2",
      "section": "Car Body",
      "subsection": "traces of repairs / use",
      "label": "Moldings curves or uneven body lines",
      "order": 200
    },
    {
      "id": "q_p2_base_car_body_repair_traces_noticeable_welds_on_body_or_bumpers",
      "groupId": "g_p2_base_car_body_repair_traces",
      "part": "part2",
      "section": "Car Body",
      "subsection": "traces of repairs / use",
      "label": "Noticeable welds on the car body, bumpers etc.",
      "order": 210
    },
    {
      "id": "q_p2_base_car_body_repair_traces_different_glass_production_dates",
      "groupId": "g_p2_base_car_body_repair_traces",
      "part": "part2",
      "section": "Car Body",
      "subsection": "traces of repairs / use",
      "label": "Different production dates, different glass manufacturers",
      "order": 220
    },
    {
      "id": "q_p2_base_car_body_repair_traces_different_lamp_production_dates",
      "groupId": "g_p2_base_car_body_repair_traces",
      "part": "part2",
      "section": "Car Body",
      "subsection": "traces of repairs / use",
      "label": "Different production dates, different lamp manufacturers",
      "order": 230
    },
    {
      "id": "q_p2_base_car_body_repair_traces_scratches_on_windshield_under_wipers",
      "groupId": "g_p2_base_car_body_repair_traces",
      "part": "part2",
      "section": "Car Body",
      "subsection": "traces of repairs / use",
      "label": "Scratches on the windshield under the wipers",
      "order": 240
    },
    {
      "id": "q_p2_base_car_body_repair_traces_damages_on_windshields",
      "groupId": "g_p2_base_car_body_repair_traces",
      "part": "part2",
      "section": "Car Body",
      "subsection": "traces of repairs / use",
      "label": "Damages on the windshields (chips, cracks)",
      "order": 250
    },
    {
      "id": "q_p2_base_engine_structure_bumpers_fenders_damaged_mounting_bolts",
      "groupId": "g_p2_base_engine_structure_bumpers_fenders",
      "part": "part2",
      "section": "Engine compartment and engine - structure and accident traces",
      "subsection": "Bumpers and fenders",
      "label": "Damaged mounting bolts (paint scratches on the bolt head)",
      "order": 260
    },
    {
      "id": "q_p2_base_engine_structure_bumpers_fenders_different_fastening_elements",
      "groupId": "g_p2_base_engine_structure_bumpers_fenders",
      "part": "part2",
      "section": "Engine compartment and engine - structure and accident traces",
      "subsection": "Bumpers and fenders",
      "label": "Different fastening elements",
      "order": 270
    },
    {
      "id": "q_p2_base_engine_structure_side_members_rust",
      "groupId": "g_p2_base_engine_structure_side_members",
      "part": "part2",
      "section": "Engine compartment and engine - structure and accident traces",
      "subsection": "Side members",
      "label": "Rust",
      "order": 280
    },
    {
      "id": "q_p2_base_engine_structure_side_members_traces_of_repairs",
      "groupId": "g_p2_base_engine_structure_side_members",
      "part": "part2",
      "section": "Engine compartment and engine - structure and accident traces",
      "subsection": "Side members",
      "label": "Traces of repairs",
      "order": 290
    },
    {
      "id": "q_p2_base_engine_structure_welds_asymmetrical_welds",
      "groupId": "g_p2_base_engine_structure_welds",
      "part": "part2",
      "section": "Engine compartment and engine - structure and accident traces",
      "subsection": "Welds",
      "label": "Asymmetrical welds",
      "order": 300
    },
    {
      "id": "q_p2_base_front_suspension_condition_signs_of_corrosion",
      "groupId": "g_p2_base_front_suspension_condition",
      "part": "part2",
      "section": "Front suspension",
      "subsection": "Suspension condition",
      "label": "signs of corrosion of the suspension",
      "order": 310
    },
    {
      "id": "q_p2_base_front_suspension_condition_cracked_rubber_parts",
      "groupId": "g_p2_base_front_suspension_condition",
      "part": "part2",
      "section": "Front suspension",
      "subsection": "Suspension condition",
      "label": "cracked rubber parts",
      "order": 320,
      "explanationRef": "exp_006"
    },
    {
      "id": "q_p2_base_front_suspension_condition_slow_return_to_vertical",